Metric_ID,Category,Metric_Name,Value,Unit,Description,Source
P2_M1,Taxonomy,"Threat_Categories_in_Taxonomy",5,count,"Number of top-level threat categories defined for agentic AI systems: (i) Prompt Injection and Jailbreaks, (ii) Autonomous Cyber-Exploitation and Tool Abuse, (iii) Multi-Agent and Protocol-Level Threats, (iv) Interface and Environment Risks, (v) Governance and Autonomy Concerns.","Agentic AI Security survey - Threat taxonomy section[web:244]"
P2_M2,Evaluation_Frameworks,"ASTRA_Agent_Archetypes",10,count,"ASTRA security evaluation framework simulates 10 agent archetypes to test agentic steerability under adversarial scenarios.","Agentic AI Security topic summary citing ASTRA framework[web:237]"
P2_M3,Evaluation_Frameworks,"ASTRA_Tools",37,count,"ASTRA framework covers 37 tools in its simulation of agent workflows for security evaluation.","Agentic AI Security topic summary citing ASTRA framework[web:237]"
P2_M4,Evaluation_Frameworks,"ASTRA_Attack_Scenarios",140,count,"ASTRA runs 140 distinct attack scenarios across tools and agent archetypes to measure guardrail violations.","Agentic AI Security topic summary citing ASTRA framework[web:237]"
P2_M5,Model_Resistance,"Grok2_On_CrewAI_Attack_Rejection_Rate",15.4,percent,"Grok2 on CrewAI rejected only 15.4% of 13 evaluated attacks, indicating high policy evasion and low robust refusal rate.","Agentic AI Security topic - Grok2 evaluation summary[web:237]"
P2_M6,Performance_Overhead,"SAGA_Overhead",5,percent,"Cryptographic and lifecycle management protocols such as SAGA are reported to keep runtime overhead below 5% while providing stronger security controls.","Agentic AI Security topic - Performance and usability trade-offs[web:237]"
P2_M7,Literature_Scope,"Approx_Papers_Surveyed",150,count,"Related agentic security survey taxonomizes over 150 papers on applications, threats, and defenses in agentic AI systems.","Survey on Agentic Security: Applications, Threats, and Defenses[web:325]"
